id,created_at,name,body,team_id,team_name,user_id,parent_id
2593,2017-09-12 08:51:28 UTC,A top level banana objective for Team A.,Details for top level Team A objective with banana detail.,244,Team A,,
2598,2017-09-12 08:54:47 UTC,How about a second kumquat key result?,And some kumquat detail.,244,Team A,,2593
2597,2017-09-12 08:54:17 UTC,Team A grape key result.,With some grape detail.,244,Team A,,2593
2594,2017-09-12 08:51:59 UTC,A Q3 peanut objective for Team A1. Q3,Some peanut detail for this Q3 objective.,246,Team A1,,
2595,2017-09-12 08:52:50 UTC,A pineapple key result for Team A1's Q3 objective.,And some pineapple detail for Team A1's Q3 Key Result.,246,Team A1,,2594
2596,2017-09-12 08:53:52 UTC,An apple key result.,And some apple detail...,246,Team A1,,2594
2599,2017-09-12 08:59:02 UTC,Q3 watermelon objective for Team B,And watermelon detail.,245,Team B,,
2600,2017-09-12 08:59:29 UTC,Q3 mango key result.,And mango detail.,245,Team B,,2599
